{
  "$schema": "../schema/residence.schema.json",
  "warning": "SYNTHETIC TEST DATA - NOT A REAL RECORD",
  "visa": "B-2",
  "visaCategory": "tourist",
  "isNonResident": true,
  "arrivalDate": "2026-05-01",
  "stayLimit": "2026-08-01",
  "lodging": "Hotel Hyundai Myeongdong (mock)",
  "arcNumber": null
}
